{"ledger_id":"CPR-LEDGER-EXAMPLE-001","run_id":"CPR-RUN-EXAMPLE-001","chapter_id":"CH-EXAMPLE","version_id":"v1","stage":"intake","open_finding_ids":[],"tracked_finding_ids":["CPR-FND-EXAMPLE-LATER"],"resolved_finding_ids":[],"blocked_count":0,"upstream_blocker_count":0,"not_applicable_count":2,"release_recommendation":"ready_with_tracked_items","owner_groups":["author","volume editor"],"created_at":"2026-08-13T00:00:00Z","supersedes":null}
